unique_id,workshop_id,sn_type,sn_id,sn_content,sn_clean,sn_token,sn_token_str,compound_s,positive_s,negative_s,neutral_s
A1_L1,A1,L,L1,"Analyzing cases, side games to stay engaged, making final decisions",analyzing cases side games to stay engaged making final decisions,"['analyze', 'case', 'game', 'stay', 'engaged', 'make', 'final', 'decision']",analyze case game stay engaged make final decision,0.4019,0.231,0.0,0.769
A1_L2,A1,L,L2,ten plus,ten plus,['plus'],plus,0.0,0.0,0.0,1.0
A1_L3,A1,L,L3,Teach a more thorough understanding of racial bias in a simple manner.,teach a more thorough understanding of racial bias in a simple manner,"['teach', 'thorough', 'understanding', 'racial', 'bias', 'simple', 'manner']",teach thorough understanding racial bias simple manner,-0.1027,0.0,0.113,0.887
A1_L4,A1,L,L4,"General knowledge of vocabulary, brief trial / court knowledge, a better understanding of racial injustice",general knowledge of vocabulary brief trial court knowledge a better understanding of racial injustice,"['general', 'knowledge', 'vocabulary', 'brief', 'trial', 'court', 'knowledge', 'well', 'understanding', 'racial', 'injustice']",general knowledge vocabulary brief trial court knowledge well understanding racial injustice,-0.2023,0.156,0.199,0.645
A1_L5,A1,L,L5,Beat all the levels (achieve a stronger knowledge of racial injustice / bias / discrimination.),beat all the levels achieve a stronger knowledge of racial injustice bias discrimination,"['beat', 'level', 'achieve', 'strong', 'knowledge', 'racial', 'injustice', 'bias', 'discrimination']",beat level achieve strong knowledge racial injustice bias discrimination,-0.3612,0.147,0.288,0.565
A1_S1,A1,S,S1,"Main player: Judge, Victim, Witness, Cop, etc",main player judge victim witness cop etc,"['main', 'player', 'judge', 'victim', 'witness', 'cop', 'etc']",main player judge victim witness cop etc,-0.2732,0.0,0.259,0.741
A1_S2,A1,S,S2,The real world,the real world,"['real', 'world']",real world,0.0,0.0,0.0,1.0
A1_S3,A1,S,S3,Based around a court case interpretation of real events that have occured.  Player's are tasked with analyzing events as accurately as possible and determine racial biases.,based around a court case interpretation of real events that have occured player s are tasked with analyzing events as accurately as possible and determine racial biases,"['base', 'court', 'case', 'interpretation', 'real', 'event', 'occur', 'player', 's', 'task', 'analyze', 'event', 'accurately', 'possible', 'determine', 'racial', 'bias']",base court case interpretation real event occur player s task analyze event accurately possible determine racial bias,0.0,0.0,0.0,1.0
A1_S4,A1,S,S4,"Interact with files, artifacts, individuals, the court in genreal",interact with files artifacts individuals the court in genreal,"['interact', 'file', 'artifact', 'individual', 'court', 'genreal']",interact file artifact individual court genreal,0.0,0.0,0.0,1.0
A1_S5,A1,S,S5,"Judge, Jury, witnesses, victims, misc. court case people",judge jury witnesses victims misc court case people,"['judge', 'jury', 'witness', 'victim', 'misc', 'court', 'case', 'people']",judge jury witness victim misc court case people,-0.3182,0.0,0.247,0.753
A1_G1,A1,G,G1,Motivation is through satisfaction of becoming educated and skilled at the game.,motivation is through satisfaction of becoming educated and skilled at the game,"['motivation', 'satisfaction', 'educate', 'skilled', 'game']",motivation satisfaction educate skilled game,0.6486,0.346,0.0,0.654
A1_G2,A1,G,G2,video game,video game,"['video', 'game']",video game,0.0,0.0,0.0,1.0
A1_G3,A1,G,G3,"Agree / Disagree to various situations.  Time limit to increase entertainement / replayability, but long enough to allow for a proper analysis.",agree disagree to various situations time limit to increase entertainement replayability but long enough to allow for a proper analysis,"['agree', 'disagree', 'situation', 'time', 'limit', 'increase', 'entertainement', 'replayability', 'long', 'allow', 'proper', 'analysis']",agree disagree situation time limit increase entertainement replayability long allow proper analysis,0.4497,0.244,0.076,0.679
A1_G4,A1,G,G4,"empathy, understanding, compassion, wonder,",empathy understanding compassion wonder,"['empathy', 'understand', 'compassion', 'wonder']",empathy understand compassion wonder,0.4588,0.5,0.0,0.5
A1_G5,A1,G,G5,Depending on actions there will be an outcome of lower / higher scores.,depending on actions there will be an outcome of lower higher scores,"['depend', 'action', 'outcome', 'low', 'high', 'score']",depend action outcome low high score,-0.296,0.0,0.167,0.833
A1_G6,A1,G,G6,"Levels, once a tutorial is finished",levels once a tutorial is finished,"['level', 'tutorial', 'finish']",level tutorial finish,0.0,0.0,0.0,1.0
A1_U1,A1,U,U1,"No, results are personal and are to be interpreted by the player themselves",no results are personal and are to be interpreted by the player themselves,"['no', 'result', 'personal', 'interpret', 'player']",no result personal interpret player,-0.296,0.0,0.155,0.845
A1_U2,A1,U,U2,Progress reports upon completion of each level and ability to go back to previous reports in a data collection window.,progress reports upon completion of each level and ability to go back to previous reports in a data collection window,"['progress', 'report', 'completion', 'level', 'ability', 'previous', 'report', 'datum', 'collection', 'window']",progress report completion level ability previous report datum collection window,0.6249,0.221,0.0,0.779
A2_L1,A2,L,L1,Skills / knowledge required: Of the judicial system. Current state of policing Racial biases Skills / knowledge gained: Deeper understanding of personal biases and how to challenge them.,skills knowledge required of the judicial system current state of policing racial biases skills knowledge gained deeper understanding of personal biases and how to challenge them,"['skill', 'knowledge', 'require', 'judicial', 'system', 'current', 'state', 'police', 'racial', 'bias', 'skill', 'knowledge', 'gain', 'deep', 'understanding', 'personal', 'bias', 'challenge']",skill knowledge require judicial system current state police racial bias skill knowledge gain deep understanding personal bias challenge,0.4404,0.14,0.0,0.86
A2_L2,A2,L,L2,Player: Offices in Training,player offices in training,"['player', 'office', 'training']",player office training,0.0,0.0,0.0,1.0
A2_L3,A2,L,L3,Goal: Collect Points,goal collect points,"['goal', 'collect', 'point']",goal collect point,0.0,0.0,0.0,1.0
A2_L4,A2,L,L4,Challenge: Resolving Racial Bias,challenge resolving racial bias,"['challenge', 'resolve', 'racial', 'bias']",challenge resolve racial bias,0.3612,0.619,0.222,0.159
A2_L5,A2,L,L5,Activities: Walking through a vague scenario.,activities walking through a vague scenario,"['activity', 'walk', 'vague', 'scenario']",activity walk vague scenario,-0.1027,0.0,0.219,0.781
A2_S1,A2,S,S1,Main Character: Police Secondary: Community members,main character police secondary community members,"['main', 'character', 'police', 'secondary', 'community', 'member']",main character police secondary community member,0.0,0.0,0.0,1.0
A2_S2,A2,S,S2,Plot: Some racially-biased situation occurred.,plot some racially biased situation occurred,"['plot', 'racially', 'biased', 'situation', 'occur']",plot racially biased situation occur,-0.2732,0.0,0.296,0.704
A2_S3,A2,S,S3,Interact with cards only.,interact with cards only,"['interact', 'card']",interact card,0.0,0.0,0.0,1.0
A2_S4,A2,S,S4,"Type of World: Non-human, alien world.",type of world non human alien world,"['type', 'world', 'non', 'human', 'alien', 'world']",type world non human alien world,0.0,0.0,0.0,1.0
A2_S5,A2,S,S5,Characters: Cop: distinct color Two different community groups of different colors Players assume roles,characters cop distinct color two different community groups of different colors players assume roles,"['character', 'cop', 'distinct', 'color', 'different', 'community', 'group', 'different', 'color', 'player', 'assume', 'role']",character cop distinct color different community group different color player assume role,0.0,0.0,0.0,1.0
A2_G1,A2,G,G1,"Motivation sustained through points / winning Forced to play the game, motivated by not getting fired.",motivation sustained through points winning forced to play the game motivated by not getting fired,"['motivation', 'sustain', 'point', 'win', 'force', 'play', 'game', 'motivate', 'not', 'getting', 'fire']",motivation sustain point win force play game motivate not getting fire,0.8786,0.541,0.115,0.345
A2_G2,A2,G,G2,Multi-level,multi level,"['multi', 'level']",multi level,0.0,0.0,0.0,1.0
A2_G3,A2,G,G3,Card Game,card game,"['card', 'game']",card game,0.0,0.0,0.0,1.0
A2_G4,A2,G,G4,Taking / discarding cards sixty seconds per action Feedback through points (each action has some number of points),taking discarding cards sixty seconds per action feedback through points each action has some number of points,"['take', 'discard', 'card', 'second', 'action', 'feedback', 'point', 'action', 'number', 'point']",take discard card second action feedback point action number point,-0.1027,0.072,0.094,0.833
A2_G5,A2,G,G5,Anger and Competiteveness,anger and competiteveness,"['anger', 'competiteveness']",anger competiteveness,-0.5719,0.0,0.649,0.351
A2_G6,A2,G,G6,Outcomes: Accumulation of points Eligibility to continue training,outcomes accumulation of points eligibility to continue training,"['outcome', 'accumulation', 'point', 'eligibility', 'continue', 'train']",outcome accumulation point eligibility continue train,0.0,0.0,0.0,1.0
A2_U1,A2,U,U1,Can share results,can share results,"['share', 'result']",share result,0.296,0.524,0.0,0.476
A2_U2,A2,U,U2,Sharing Total Points,sharing total points,"['share', 'total', 'point']",share total point,0.4215,0.583,0.0,0.417
A2_U3,A2,U,U3,Progress : Reported through points.,progress reported through points,"['progress', 'report', 'point']",progress report point,0.4215,0.483,0.0,0.517
A2_U4,A2,U,U4,Progress Points,progress points,"['progress', 'point']",progress point,0.4215,0.737,0.0,0.263
A3_L1,A3,L,L1,to overcome the learning challenges; identify ways of incorporating those outcomes in the day-to-day; challenging one's own habits and patterns; self-forgiveness; modelling trust as a way to achieving safety,to overcome the learning challenges identify ways of incorporating those outcomes in the day to day challenging one s own habits and patterns self forgiveness modelling trust as a way to achieving safety,"['overcome', 'learning', 'challenge', 'identify', 'way', 'incorporate', 'outcome', 'day', 'day', 'challenge', 's', 'habit', 'pattern', 'self', 'forgiveness', 'modelling', 'trust', 'way', 'achieve', 'safety']",overcome learning challenge identify way incorporate outcome day day challenge s habit pattern self forgiveness modelling trust way achieve safety,0.8442,0.284,0.0,0.716
A3_L2,A3,L,L2,anyone; police officers; community members involved in policing; elected officials; teachers; students; school administration; justice advocates; mental health professionals; law and policy makers; community advocate working to influence policy; university proessirs; university administrators,anyone police officers community members involved in policing elected officials teachers students school administration justice advocates mental health professionals law and policy makers community advocate working to influence policy university proessirs university administrators,"['police', 'officer', 'community', 'member', 'involve', 'police', 'elect', 'official', 'teacher', 'student', 'school', 'administration', 'justice', 'advocate', 'mental', 'health', 'professional', 'law', 'policy', 'maker', 'community', 'advocate', 'work', 'influence', 'policy', 'university', 'proessir', 'university', 'administrator']",police officer community member involve police elect official teacher student school administration justice advocate mental health professional law policy maker community advocate work influence policy university proessir university administrator,0.5267,0.096,0.0,0.904
A3_L3,A3,L,L3,how to empathize; how to identify one's own unconscious biases; how to share one's own experience; how to be vulnerable in sharing personal experience; recognizing mistakes; recognizing patterns of bias or racial injustice in the community; how to recognize that change can happen / developing hopefulness,how to empathize how to identify one s own unconscious biases how to share one s own experience how to be vulnerable in sharing personal experience recognizing mistakes recognizing patterns of bias or racial injustice in the community how to recognize that change can happen developing hopefulness,"['empathize', 'identify', 's', 'unconscious', 'bias', 'share', 's', 'experience', 'vulnerable', 'share', 'personal', 'experience', 'recognize', 'mistake', 'recognize', 'pattern', 'bias', 'racial', 'injustice', 'community', 'recognize', 'change', 'happen', 'develop', 'hopefulness']",empathize identify s unconscious bias share s experience vulnerable share personal experience recognize mistake recognize pattern bias racial injustice community recognize change happen develop hopefulness,-0.2263,0.133,0.166,0.701
A3_L4,A3,L,L4,game design; there is a time barrier to communicate what one knows of the story to other players,game design there is a time barrier to communicate what one knows of the story to other players,"['game', 'design', 'time', 'barrier', 'communicate', 'know', 'story', 'player']",game design time barrier communicate know story player,-0.128,0.0,0.081,0.919
A3_L5,A3,L,L5,"Given one scenario and certain restrictions, the players will try to communcate the 'story' to each other. At the beginning players are given prompt cards about their situation that only they have knowledge about. other players have to understand what the issues are but there are limitatons to communication. Other players might have limited information such as racial identify. The learning outcome is to work around communication barriers and to identify the implicit assmptions or biases. Resources to better understand things come later.",given one scenario and certain restrictions the players will try to communcate the story to each other at the beginning players are given prompt cards about their situation that only they have knowledge about other players have to understand what the issues are but there are limitatons to communication other players might have limited information such as racial identify the learning outcome is to work around communication barriers and to identify the implicit assmptions or biases resources to better understand things come later,"['give', 'scenario', 'certain', 'restriction', 'player', 'try', 'communcate', 'story', 'begin', 'player', 'give', 'prompt', 'card', 'situation', 'knowledge', 'player', 'understand', 'issue', 'limitaton', 'communication', 'player', 'limited', 'information', 'racial', 'identify', 'learning', 'outcome', 'work', 'communication', 'barrier', 'identify', 'implicit', 'assmption', 'bias', 'resource', 'well', 'understand', 'thing', 'come', 'later']",give scenario certain restriction player try communcate story begin player give prompt card situation knowledge player understand issue limitaton communication player limited information racial identify learning outcome work communication barrier identify implicit assmption bias resource well understand thing come later,0.4678,0.062,0.027,0.912
A3_L6,A3,L,L6,Little skills or knowledge required. Same spoken language. Cursory knowledge of the mental health and policing systems in USA. (or maybe not! could be gained in game). Skills and knowledge gained: awareness of implicit bias; better communication; identification of communication needs; dealing with the time barrier to understand why people don't access specific resources; How to make a care plan,little skills or knowledge required same spoken language cursory knowledge of the mental health and policing systems in usa or maybe not could be gained in game skills and knowledge gained awareness of implicit bias better communication identification of communication needs dealing with the time barrier to understand why people don t access specific resources how to make a care plan,"['little', 'skill', 'knowledge', 'require', 'spoken', 'language', 'cursory', 'knowledge', 'mental', 'health', 'policing', 'system', 'usa', 'maybe', 'not', 'gain', 'game', 'skill', 'knowledge', 'gain', 'awareness', 'implicit', 'bias', 'well', 'communication', 'identification', 'communication', 'need', 'deal', 'time', 'barrier', 'understand', 'people', 'don', 't', 'access', 'specific', 'resource', 'care', 'plan']",little skill knowledge require spoken language cursory knowledge mental health policing system usa maybe not gain game skill knowledge gain awareness implicit bias well communication identification communication need deal time barrier understand people don t access specific resource care plan,0.6824,0.126,0.074,0.8
A3_S1,A3,S,S1,"The story takes place in the USA. Involving a conflict between a white person and a black person and the police is present. Police has to address the situation [sorry so vague]; Mental health patient, BIPOC. Smashed his face into the cop car to be taken to the hospital instead of back to the insitution. Had to be restrained, cops and security handling him, and no mental health support. Stayed in ICU. How to provide an avenue for resolution / well being and safety with resources? who else to call? How to appraoch?",the story takes place in the usa involving a conflict between a white person and a black person and the police is present police has to address the situation sorry so vague mental health patient bipoc smashed his face into the cop car to be taken to the hospital instead of back to the insitution had to be restrained cops and security handling him and no mental health support stayed in icu how to provide an avenue for resolution well being and safety with resources who else to call how to appraoch,"['story', 'take', 'place', 'usa', 'involve', 'conflict', 'white', 'person', 'black', 'person', 'police', 'present', 'police', 'address', 'situation', 'sorry', 'vague', 'mental', 'health', 'patient', 'bipoc', 'smash', 'face', 'cop', 'car', 'take', 'hospital', 'instead', 'insitution', 'restrain', 'cop', 'security', 'handle', 'no', 'mental', 'health', 'support', 'stay', 'icu', 'provide', 'avenue', 'resolution', 'safety', 'resource', 'appraoch']",story take place usa involve conflict white person black person police present police address situation sorry vague mental health patient bipoc smash face cop car take hospital instead insitution restrain cop security handle no mental health support stay icu provide avenue resolution safety resource appraoch,0.5161,0.098,0.075,0.826
A3_S2,A3,S,S2,"In Detroit, now, pandemic, world with other confounding issues. Post trump presidency, mental health issues are exacerbated and central part of the story. Health issues are a big part of it. Trauma response.",in detroit now pandemic world with other confounding issues post trump presidency mental health issues are exacerbated and central part of the story health issues are a big part of it trauma response,"['detroit', 'pandemic', 'world', 'confounding', 'issue', 'post', 'trump', 'presidency', 'mental', 'health', 'issue', 'exacerbate', 'central', 'story', 'health', 'issue', 'big', 'trauma', 'response']",detroit pandemic world confounding issue post trump presidency mental health issue exacerbate central story health issue big trauma response,-0.4215,0.0,0.08,0.92
A3_S3,A3,S,S3,(1) Black mental health patient (2) First response police officer (PLAYER PLAYS THIS ROLE) (3) social worker (4) nurses and healthcare workers (5) patient's family (6) patient's community,black mental health patient first response police officer player plays this role social worker nurses and healthcare workers patient s family patient s community,"['black', 'mental', 'health', 'patient', 'response', 'police', 'officer', 'player', 'play', 'role', 'social', 'worker', 'nurse', 'healthcare', 'worker', 'patient', 's', 'family', 'patient', 's', 'community']",black mental health patient response police officer player play role social worker nurse healthcare worker patient s family patient s community,0.25,0.08,0.0,0.92
A3_S4,A3,S,S4,"Interact with cards holding information about stories. Interact with each other to communicate what is going on with limitations. Interact with cards that might pose limitations (time limits). Interact with cards that can bring resources options into the game, including more time to communicate, other characters",interact with cards holding information about stories interact with each other to communicate what is going on with limitations interact with cards that might pose limitations time limits interact with cards that can bring resources options into the game including more time to communicate other characters,"['interact', 'card', 'hold', 'information', 'story', 'interact', 'communicate', 'go', 'limitation', 'interact', 'card', 'pose', 'limitation', 'time', 'limit', 'interact', 'card', 'bring', 'resource', 'option', 'game', 'include', 'time', 'communicate', 'character']",interact card hold information story interact communicate go limitation interact card pose limitation time limit interact card bring resource option game include time communicate character,0.0,0.0,0.0,1.0
A3_S5,A3,S,S5,"Main character is the police officer making decisions. Main secondary character would be the patient. other secondary characters are resources and the community such as social worker, nurse, etc. Players can switch roles based on their real roles in society i.e. police offer could play the patient or nurse.",main character is the police officer making decisions main secondary character would be the patient other secondary characters are resources and the community such as social worker nurse etc players can switch roles based on their real roles in society i e police offer could play the patient or nurse,"['main', 'character', 'police', 'officer', 'make', 'decision', 'main', 'secondary', 'character', 'patient', 'secondary', 'character', 'resource', 'community', 'social', 'worker', 'nurse', 'etc', 'player', 'switch', 'role', 'base', 'real', 'role', 'society', 'e', 'police', 'offer', 'play', 'patient', 'nurse']",main character police officer make decision main secondary character patient secondary character resource community social worker nurse etc player switch role base real role society e police offer play patient nurse,0.34,0.047,0.0,0.953
A3_G1,A3,G,G1,"levels based on comfort, on self-evaluated literacy on anti-racism topics. Yes.",levels based on comfort on self evaluated literacy on anti racism topics yes,"['level', 'base', 'comfort', 'self', 'evaluate', 'literacy', 'anti', 'racism', 'topic', 'yes']",level base comfort self evaluate literacy anti racism topic yes,-0.296,0.252,0.311,0.437
A3_G2,A3,G,G2,"curiosity, resentment, guilt, hope, pain, sadness, anger, solidarity, optimism",curiosity resentment guilt hope pain sadness anger solidarity optimism,"['curiosity', 'resentment', 'guilt', 'hope', 'pain', 'sadness', 'anger', 'solidarity', 'optimism']",curiosity resentment guilt hope pain sadness anger solidarity optimism,-0.743,0.351,0.608,0.041
A3_G3,A3,G,G3,serious game,serious game,['game'],game,-0.0772,0.0,0.565,0.435
A3_G4,A3,G,G4,They can talk or pass notes to each other;,they can talk or pass notes to each other,"['talk', 'pass', 'note']",talk pass note,0.0,0.0,0.0,1.0
A3_G5,A3,G,G5,Choosing the direction the game goes; They will be able to see how certain actions lead to communication breakdown while others lead to better problem solving.,choosing the direction the game goes they will be able to see how certain actions lead to communication breakdown while others lead to better problem solving,"['choose', 'direction', 'game', 'go', 'able', 'certain', 'action', 'lead', 'communication', 'breakdown', 'lead', 'well', 'problem', 'solve']",choose direction game go able certain action lead communication breakdown lead well problem solve,0.5719,0.231,0.084,0.685
A3_G6,A3,G,G6,"Cool if players could see what happens when communicaton breaks down; To sustain motivation we offer resources as the game progresses; The game starts with many limitations, for example with communication or language. Perhaps only communicating with notes or with a  limitation on what words you can use. Or you can only talk to specific people. but in another stage of the game communication can be more free between players.",cool if players could see what happens when communicaton breaks down to sustain motivation we offer resources as the game progresses the game starts with many limitations for example with communication or language perhaps only communicating with notes or with a limitation on what words you can use or you can only talk to specific people but in another stage of the game communication can be more free between players,"['cool', 'player', 'happen', 'communicaton', 'break', 'sustain', 'motivation', 'offer', 'resource', 'game', 'progress', 'game', 'start', 'limitation', 'example', 'communication', 'language', 'communicate', 'note', 'limitation', 'word', 'use', 'talk', 'specific', 'people', 'stage', 'game', 'communication', 'free', 'player']",cool player happen communicaton break sustain motivation offer resource game progress game start limitation example communication language communicate note limitation word use talk specific people stage game communication free player,0.7677,0.109,0.021,0.87
A3_U1,A3,U,U1,Yes sharing in group discussion. Disclosure is important.,yes sharing in group discussion disclosure is important,"['yes', 'share', 'group', 'discussion', 'disclosure', 'important']",yes share group discussion disclosure important,0.743,0.593,0.0,0.407
