unique_id,workshop_id,sn_type,sn_id,sn_content,sn_clean,sn_token,sn_token_str,compound_s,positive_s,negative_s,neutral_s
A3_U2,A3,U,U2,At different stages there are debriefs about every players' interpretation about what's going on.,at different stages there are debriefs about every players interpretation about what s going on,"['different', 'stage', 'debrief', 'player', 'interpretation', 's', 'go']",different stage debrief player interpretation s go,0.0,0.0,0.0,1.0
A4_L1,A4,L,L1,Feedback on how you played the game Shifting perspectives Player interaction,feedback on how you played the game shifting perspectives player interaction,"['feedback', 'play', 'game', 'shift', 'perspective', 'player', 'interaction']",feedback play game shift perspective player interaction,0.34,0.194,0.0,0.806
A4_L2,A4,L,L2,"Need knowledge, intuition, streets smarts Game accessible to everyone Gain: different perspectives",need knowledge intuition streets smarts game accessible to everyone gain different perspectives,"['need', 'knowledge', 'intuition', 'street', 'smart', 'game', 'accessible', 'gain', 'different', 'perspective']",need knowledge intuition street smart game accessible gain different perspective,0.7184,0.375,0.0,0.625
A4_L3,A4,L,L3,understanding just okaying the game to play it all about the side quest each character could have its own individual drive (challenge & a goal) realistic behaviour behave in a way that you think is good,understanding just okaying the game to play it all about the side quest each character could have its own individual drive challenge a goal realistic behaviour behave in a way that you think is good,"['understanding', 'okay', 'game', 'play', 'quest', 'character', 'individual', 'drive', 'challenge', 'goal', 'realistic', 'behaviour', 'behave', 'way', 'think', 'good']",understanding okay game play quest character individual drive challenge goal realistic behaviour behave way think good,0.6808,0.171,0.0,0.829
A4_L4,A4,L,L4,partially understanding other perspectives coproducing a solution to community oriented policing compassion between community members and cops making cops understand their role in the community on a broader structural level / reevaluation of their role,partially understanding other perspectives coproducing a solution to community oriented policing compassion between community members and cops making cops understand their role in the community on a broader structural level reevaluation of their role,"['partially', 'understand', 'perspective', 'coproduce', 'solution', 'community', 'orient', 'policing', 'compassion', 'community', 'member', 'cop', 'make', 'cop', 'understand', 'role', 'community', 'broad', 'structural', 'level', 'reevaluation', 'role']",partially understand perspective coproduce solution community orient policing compassion community member cop make cop understand role community broad structural level reevaluation role,0.6486,0.142,0.0,0.858
A4_L5,A4,L,L5,community members cops played separately  or sometimes together? specific characters: different characters with different interests,community members cops played separately or sometimes together specific characters different characters with different interests,"['community', 'member', 'cop', 'play', 'separately', 'specific', 'character', 'different', 'character', 'different', 'interest']",community member cop play separately specific character different character different interest,0.5267,0.253,0.0,0.747
A4_S1,A4,S,S1,Players interact with other characters (both player controlled and others),players interact with other characters both player controlled and others,"['player', 'interact', 'character', 'player', 'control']",player interact character player control,0.0,0.0,0.0,1.0
A4_S2,A4,S,S2,"Player controlled characters are main characters, secondary characters are others not controlled by characters The backgrounds of characters are made by players",player controlled characters are main characters secondary characters are others not controlled by characters the backgrounds of characters are made by players,"['player', 'control', 'character', 'main', 'character', 'secondary', 'character', 'not', 'control', 'character', 'background', 'character', 'player']",player control character main character secondary character not control character background character player,0.0,0.0,0.0,1.0
A4_S3,A4,S,S3,real world our world steamy alleyways could be sci-fi fantasy and still give insight into the world could be metaphorical or an imagined future (bezos and musk on Mars) include a historical connection that mirrors the real history of policing a place of conflict part of the world where police and community members interact,real world our world steamy alleyways could be sci fi fantasy and still give insight into the world could be metaphorical or an imagined future bezos and musk on mars include a historical connection that mirrors the real history of policing a place of conflict part of the world where police and community members interact,"['real', 'world', 'world', 'steamy', 'alleyway', 'sci', 'fi', 'fantasy', 'insight', 'world', 'metaphorical', 'imagine', 'future', 'bezos', 'musk', 'mars', 'include', 'historical', 'connection', 'mirror', 'real', 'history', 'police', 'place', 'conflict', 'world', 'police', 'community', 'member', 'interact']",real world world steamy alleyway sci fi fantasy insight world metaphorical imagine future bezos musk mars include historical connection mirror real history police place conflict world police community member interact,-0.3182,0.0,0.041,0.959
A4_S4,A4,S,S4,different scenarios something bad happened and police get involved police get involved for no good reason interactions between police and community members realistic,different scenarios something bad happened and police get involved police get involved for no good reason interactions between police and community members realistic,"['different', 'scenario', 'bad', 'happen', 'police', 'involve', 'police', 'involve', 'no', 'good', 'reason', 'interaction', 'police', 'community', 'member', 'realistic']",different scenario bad happen police involve police involve no good reason interaction police community member realistic,-0.7101,0.0,0.22,0.78
A4_G1,A4,G,G1,"very serious game ""civilization"" game simulation game SIMS game GTA game",very serious game civilization game simulation game sims game gta game,"['game', 'civilization', 'game', 'simulation', 'game', 'sims', 'game', 'gta', 'game']",game civilization game simulation game sims game gta game,-0.1513,0.0,0.137,0.863
A4_G2,A4,G,G2,discomfort anger sadness controversial decision making sense of community clarity,discomfort anger sadness controversial decision making sense of community clarity,"['discomfort', 'anger', 'sadness', 'controversial', 'decision', 'make', 'sense', 'community', 'clarity']",discomfort anger sadness controversial decision make sense community clarity,-0.8176,0.143,0.593,0.265
A4_G3,A4,G,G3,different parts missions stars badges that allow you to play certain parts (like in the real world),different parts missions stars badges that allow you to play certain parts like in the real world,"['different', 'part', 'mission', 'star', 'badge', 'allow', 'play', 'certain', 'part', 'like', 'real', 'world']",different part mission star badge allow play certain part like real world,0.7845,0.406,0.0,0.594
A4_G4,A4,G,G4,Unlock more characters to play Multiple currencies (Not just money) Social Exchange Make it mandatory as part of training,unlock more characters to play multiple currencies not just money social exchange make it mandatory as part of training,"['unlock', 'character', 'play', 'multiple', 'currency', 'not', 'money', 'social', 'exchange', 'mandatory', 'training']",unlock character play multiple currency not money social exchange mandatory training,0.4522,0.189,0.0,0.811
A4_G5,A4,G,G5,"Definitely have feedback, resources at risk Players themselves decide what actions are available and costs",definitely have feedback resources at risk players themselves decide what actions are available and costs,"['definitely', 'feedback', 'resource', 'risk', 'player', 'decide', 'action', 'available', 'cost']",definitely feedback resource risk player decide action available cost,0.1531,0.152,0.118,0.73
A4_U1,A4,U,U1,Yes,yes,['yes'],yes,0.4019,1.0,0.0,0.0
A4_U2,A4,U,U2,Progress: Characters level up and gain resources currencies Evaluations of character progress,progress characters level up and gain resources currencies evaluations of character progress,"['progress', 'character', 'level', 'gain', 'resource', 'currency', 'evaluation', 'character', 'progress']",progress character level gain resource currency evaluation character progress,0.8402,0.5,0.0,0.5
A4_U3,A4,U,U3,Allow people to share if they want - Safe space Final player summaries evaluations,allow people to share if they want safe space final player summaries evaluations,"['allow', 'people', 'share', 'want', 'safe', 'space', 'final', 'player', 'summary', 'evaluation']",allow people share want safe space final player summary evaluation,0.743,0.48,0.0,0.52
A5_L1,A5,L,L1,reduced bias in own actions,reduced bias in own actions,"['reduce', 'bias', 'action']",reduce bias action,-0.1027,0.0,0.259,0.741
A5_L2,A5,L,L2,statistics fact checking,statistics fact checking,"['statistic', 'fact', 'check']",statistic fact check,0.0,0.0,0.0,1.0
A5_L3,A5,L,L3,understanding own bias,understanding own bias,"['understand', 'bias']",understand bias,-0.1027,0.0,0.412,0.588
A5_L4,A5,L,L4,police academy students,police academy students,"['police', 'academy', 'student']",police academy student,0.0,0.0,0.0,1.0
A5_L5,A5,L,L5,rewards and penalties,rewards and penalties,"['reward', 'penalty']",reward penalty,0.4767,0.608,0.0,0.392
A5_L6,A5,L,L6,tradeoffs,tradeoffs,['tradeoff'],tradeoff,0.0,0.0,0.0,1.0
A5_L7,A5,L,L7,video,video,['video'],video,0.0,0.0,0.0,1.0
A5_L8,A5,L,L8,roleplay,roleplay,['roleplay'],roleplay,0.0,0.0,0.0,1.0
A5_L9,A5,L,L9,how bias is experienced,how bias is experienced,"['bias', 'experience']",bias experience,-0.1027,0.0,0.318,0.682
A5_L10,A5,L,L10,understanding racial bias,understanding racial bias,"['understand', 'racial', 'bias']",understand racial bias,-0.1027,0.0,0.412,0.588
A5_L11,A5,L,L11,what bias looks like,what bias looks like,"['bias', 'look', 'like']",bias look like,0.2732,0.424,0.237,0.339
A5_L12,A5,L,L12,understand what bias is,understand what bias is,"['understand', 'bias']",understand bias,-0.1027,0.0,0.318,0.682
A5_L13,A5,L,L13,understanding different worldviews,understanding different worldviews,"['understand', 'different', 'worldview']",understand different worldview,0.0,0.0,0.0,1.0
A5_L14,A5,L,L14,self review,self review,"['self', 'review']",self review,0.0,0.0,0.0,1.0
A5_L15,A5,L,L15,age restriction is eighteen,age restriction is eighteen,"['age', 'restriction']",age restriction,-0.2732,0.0,0.412,0.588
A5_L16,A5,L,L16,anyone should be able to play,anyone should be able to play,"['able', 'play']",able play,0.34,0.324,0.0,0.676
A5_S1,A5,S,S1,lord of the flies theme,lord of the flies theme,"['lord', 'fly', 'theme']",lord fly theme,0.0,0.0,0.0,1.0
A5_S2,A5,S,S2,realistic but dont fully understand the parallels,realistic but dont fully understand the parallels,"['realistic', 'nt', 'fully', 'understand', 'parallel']",realistic nt fully understand parallel,0.0,0.0,0.0,1.0
A5_S3,A5,S,S3,creatures and animals but in the end realize that they are actually people,creatures and animals but in the end realize that they are actually people,"['creature', 'animal', 'end', 'realize', 'actually', 'people']",creature animal end realize actually people,0.0,0.0,0.0,1.0
A5_S4,A5,S,S4,card game board game mixed medium video,card game board game mixed medium video,"['card', 'game', 'board', 'game', 'mix', 'medium', 'video']",card game board game mix medium video,0.0,0.0,0.0,1.0
A5_S5,A5,S,S5,physical version and online version,physical version and online version,"['physical', 'version', 'online', 'version']",physical version online version,0.0,0.0,0.0,1.0
A5_S6,A5,S,S6,realy scary animals and really cute animals but scary ones not actually bad,realy scary animals and really cute animals but scary ones not actually bad,"['realy', 'scary', 'animal', 'cute', 'animal', 'scary', 'one', 'not', 'actually', 'bad']",realy scary animal cute animal scary one not actually bad,-0.1226,0.278,0.3,0.422
A5_G1,A5,G,G1,at the end you review your decisions and analyse yourself and understand own bias,at the end you review your decisions and analyse yourself and understand own bias,"['end', 'review', 'decision', 'analyse', 'understand', 'bias']",end review decision analyse understand bias,-0.1027,0.0,0.097,0.903
A5_G2,A5,G,G2,helping or not helping,helping or not helping,"['help', 'not', 'help']",help not help,0.0803,0.361,0.31,0.329
A5_G3,A5,G,G3,many levels,many levels,['level'],level,0.0,0.0,0.0,1.0
A5_G4,A5,G,G4,having fun,having fun,"['have', 'fun']",have fun,0.5106,0.767,0.0,0.233
A5_G5,A5,G,G5,Roleplay,roleplay,['roleplay'],roleplay,0.0,0.0,0.0,1.0
A5_G6,A5,G,G6,winning,winning,['win'],win,0.5267,1.0,0.0,0.0
A5_G7,A5,G,G7,peace,peace,['peace'],peace,0.5423,1.0,0.0,0.0
A5_G8,A5,G,G8,Levels,levels,['level'],level,0.0,0.0,0.0,1.0
A5_G9,A5,G,G9,fear,fear,['fear'],fear,-0.4939,0.0,1.0,0.0
A5_G10,A5,G,G10,Empathy,empathy,['empathy'],empathy,0.0,0.0,0.0,1.0
A5_G11,A5,G,G11,compassion,compassion,['compassion'],compassion,0.4588,1.0,0.0,0.0
A6_L1,A6,L,L1,immediate reflection as witness action effects and later reflection once see all other possible scenariso,immediate reflection as witness action effects and later reflection once see all other possible scenariso,"['immediate', 'reflection', 'witness', 'action', 'effect', 'later', 'reflection', 'possible', 'scenariso']",immediate reflection witness action effect later reflection possible scenariso,0.0,0.0,0.0,1.0
A6_L2,A6,L,L2,"questions during the game (surprising) and after the game, WHY?",questions during the game surprising and after the game why,"['question', 'game', 'surprising', 'game']",question game surprising game,0.2732,0.189,0.0,0.811
A6_L3,A6,L,L3,"multiplayer, police officers, community members (get insight)",multiplayer police officers community members get insight,"['multiplayer', 'police', 'officer', 'community', 'member', 'insight']",multiplayer police officer community member insight,0.0,0.0,0.0,1.0
A6_L4,A6,L,L4,crowdsourcing from community members to see difference between the two,crowdsourcing from community members to see difference between the two,"['crowdsource', 'community', 'member', 'difference']",crowdsource community member difference,0.0,0.0,0.0,1.0
A6_L5,A6,L,L5,community players (gathering info) police (distributing),community players gathering info police distributing,"['community', 'player', 'gather', 'info', 'police', 'distribute']",community player gather info police distribute,0.0,0.0,0.0,1.0
A6_L6,A6,L,L6,"explain whats wrong with current community oriented policing and how to improve, discover new perspective",explain whats wrong with current community oriented policing and how to improve discover new perspective,"['explain', 's', 'wrong', 'current', 'community', 'orient', 'policing', 'improve', 'discover', 'new', 'perspective']",explain s wrong current community orient policing improve discover new perspective,-0.0516,0.153,0.163,0.684
A6_L7,A6,L,L7,"learning on police bias (what it is, how to recognize it, how its bad, and how to act on it)",learning on police bias what it is how to recognize it how its bad and how to act on it,"['learn', 'police', 'bias', 'recognize', 'bad', 'act']",learn police bias recognize bad act,-0.5994,0.0,0.214,0.786
A6_L8,A6,L,L8,"skills: be a licensed cop, gained: insight, broader analysis of what piolcing is and what effect it has on people's lives",skills be a licensed cop gained insight broader analysis of what piolcing is and what effect it has on people s lives,"['skill', 'licensed', 'cop', 'gain', 'insight', 'broad', 'analysis', 'piolcing', 'effect', 'people', 's', 'life']",skill licensed cop gain insight broad analysis piolcing effect people s life,0.3818,0.11,0.0,0.89
A6_L9,A6,L,L9,skills: be a community members who deals with police regulary (subjesct),skills be a community members who deals with police regulary subjesct,"['skill', 'community', 'member', 'deal', 'police', 'regulary', 'subjesct']",skill community member deal police regulary subjesct,0.0,0.0,0.0,1.0
A6_S1,A6,S,S1,world: setting similar to participant lives,world setting similar to participant lives,"['world', 'set', 'similar', 'participant', 'life']",world set similar participant life,0.0,0.0,0.0,1.0
A6_S2,A6,S,S2,"the plot is up to the players, it develops based on how people play the game",the plot is up to the players it develops based on how people play the game,"['plot', 'player', 'develop', 'base', 'people', 'play', 'game']",plot player develop base people play game,0.34,0.138,0.0,0.862
A6_S3,A6,S,S3,"some structure, with possibility to look back at the end",some structure with possibility to look back at the end,"['structure', 'possibility', 'look', 'end']",structure possibility look end,0.0,0.0,0.0,1.0
A6_S4,A6,S,S4,"""criminals"" + cop",criminals  cop,"['criminal', 'cop']",criminal cop,-0.5719,0.0,0.787,0.213
A6_S5,A6,S,S5,characters: main protagonist (cop and partner) and people they interact with,characters main protagonist cop and partner and people they interact with,"['character', 'main', 'protagonist', 'cop', 'partner', 'people', 'interact']",character main protagonist cop partner people interact,0.0,0.0,0.0,1.0
A6_S6,A6,S,S6,characters reversed community: end up on the police end,characters reversed community end up on the police end,"['character', 'reverse', 'community', 'end', 'police', 'end']",character reverse community end police end,0.0,0.0,0.0,1.0
A6_S7,A6,S,S7,characters: people as main player and cop as second,characters people as main player and cop as second,"['character', 'people', 'main', 'player', 'cop', 'second']",character people main player cop second,0.0,0.0,0.0,1.0
A6_S8,A6,S,S8,explicit and relatable setting,explicit and relatable setting,"['explicit', 'relatable', 'setting']",explicit relatable setting,0.0,0.0,0.0,1.0
A6_S9,A6,S,S9,"characters: cops, community members",characters cops community members,"['character', 'cop', 'community', 'member']",character cop community member,0.0,0.0,0.0,1.0
A6_G1,A6,G,G1,illustrative/visuals and people's interpretations based game,illustrative visuals and people s interpretations based game,"['illustrative', 'visual', 'people', 's', 'interpretation', 'base', 'game']",illustrative visual people s interpretation base game,0.0,0.0,0.0,1.0
A6_G2,A6,G,G2,"motivation: mandatory, recurring",motivation mandatory recurring,"['motivation', 'mandatory', 'recur']",motivation mandatory recur,0.4019,0.787,0.0,0.213
A6_G3,A6,G,G3,see an idea/image first and then everyone gives opinion on it,see an idea image first and then everyone gives opinion on it,"['idea', 'image', 'give', 'opinion']",idea image give opinion,0.0,0.0,0.0,1.0
A6_G4,A6,G,G4,"different levels, different parts, evolving",different levels different parts evolving,"['different', 'level', 'different', 'part', 'evolve']",different level different part evolve,0.0,0.0,0.0,1.0
A6_G5,A6,G,G5,"motivation: game should be engaging, game should be well produced/cool/designed",motivation game should be engaging game should be well produced cool designed,"['motivation', 'game', 'engage', 'game', 'produce', 'cool', 'design']",motivation game engage game produce cool design,0.802,0.535,0.0,0.465
A6_G6,A6,G,G6,"shame, discovery, bewilderment",shame discovery bewilderment,"['shame', 'discovery', 'bewilderment']",shame discovery bewilderment,-0.4767,0.0,0.608,0.392
A6_G7,A6,G,G7,"outcome: moves the story along, player sees what happens after immediate action, in the end player sees all other possible scenarios",outcome moves the story along player sees what happens after immediate action in the end player sees all other possible scenarios,"['outcome', 'move', 'story', 'player', 'see', 'happen', 'immediate', 'action', 'end', 'player', 'see', 'possible', 'scenario']",outcome move story player see happen immediate action end player see possible scenario,0.0,0.0,0.0,1.0
A6_G8,A6,G,G8,"multi choice thing, time-pressure, feedback at end",multi choice thing time pressure feedback at end,"['multi', 'choice', 'thing', 'time', 'pressure', 'feedback', 'end']",multi choice thing time pressure feedback end,-0.296,0.0,0.239,0.761
A6_G9,A6,G,G9,"discomfort, curiosity, vulnerability",discomfort curiosity vulnerability,"['discomfort', 'curiosity', 'vulnerability']",discomfort curiosity vulnerability,-0.5719,0.0,0.825,0.175
A6_U1,A6,U,U1,share game results: yes,share game results yes,"['share', 'game', 'result', 'yes']",share game result yes,0.5994,0.71,0.0,0.29
A6_U2,A6,U,U2,progress reports: report shown only when player stops at end. Analysis has to be nuanced and insightful,progress reports report shown only when player stops at end analysis has to be nuanced and insightful,"['progress', 'report', 'report', 'show', 'player', 'stop', 'end', 'analysis', 'nuanced', 'insightful']",progress report report show player stop end analysis nuanced insightful,0.296,0.144,0.082,0.773
A6_U3,A6,U,U3,"results shared: built into the game, results shown anonymous but no choice, nameless statistics on areas, voluntarily share",results shared built into the game results shown anonymous but no choice nameless statistics on areas voluntarily share,"['result', 'shared', 'build', 'game', 'result', 'show', 'anonymous', 'no', 'choice', 'nameless', 'statistic', 'area', 'voluntarily', 'share']",result shared build game result show anonymous no choice nameless statistic area voluntarily share,0.1779,0.202,0.126,0.673
