unique_id,workshop_id,sn_type,sn_id,sn_content,sn_clean,sn_token,sn_token_str,compound_s,positive_s,negative_s,neutral_s
B1_S1,B1,S,S1,garden variety policing interaction and work your way up,garden variety policing interaction and work your way up,"['garden', 'variety', 'policing', 'interaction', 'work', 'way']",garden variety policing interaction work way,0.0,0.0,0.0,1.0
B1_S2,B1,S,S2,cops and community members; not assuming roles,cops and community members not assuming roles,"['cop', 'community', 'member', 'not', 'assume', 'role']",cop community member not assume role,0.0,0.0,0.0,1.0
B1_S3,B1,S,S3,everyone is their own main and secondary character,everyone is their own main and secondary character,"['main', 'secondary', 'character']",main secondary character,0.0,0.0,0.0,1.0
B1_S4,B1,S,S4,Interact with eachother (the other players) they are having dialogues with each other,interact with eachother the other players they are having dialogues with each other,"['interact', 'eachother', 'player', 'have', 'dialogue']",interact eachother player have dialogue,0.0,0.0,0.0,1.0
B1_S5,B1,S,S5,reality and the world we want,reality and the world we want,"['reality', 'world', 'want']",reality world want,0.0772,0.20600000000000002,0.0,0.794
B2_S1,B2,S,S1,urban adventure; survival; theme park,urban adventure survival theme park,"['urban', 'adventure', 'survival', 'theme', 'park']",urban adventure survival theme park,0.3182,0.365,0.0,0.635
B2_S2,B2,S,S2,primary  your neighborhood community (tracy's park example) secondary  those trying to prevent your success slow you down,primary your neighborhood community tracy s park example secondary those trying to prevent your success slow you down,"['primary', 'neighborhood', 'community', 'tracy', 's', 'park', 'example', 'secondary', 'try', 'prevent', 'success', 'slow']",primary neighborhood community tracy s park example secondary try prevent success slow,0.5859,0.231,0.0,0.769
B2_S3,B2,S,S3,"interacting with seconday characters and each other, also the obstacles they're trying to overcome",interacting with seconday characters and each other also the obstacles they re trying to overcome,"['interact', 'seconday', 'character', 'obstacle', 'try', 'overcome']",interact seconday character obstacle try overcome,-0.3818,0.0,0.157,0.843
B3_S1,B3,S,S1,regular person moving through life doing regular things in a heavily policed community with challenges outside of characater Control,regular person moving through life doing regular things in a heavily policed community with challenges outside of characater control,"['regular', 'person', 'move', 'life', 'regular', 'thing', 'heavily', 'police', 'community', 'challenge', 'outside', 'characater', 'control']",regular person move life regular thing heavily police community challenge outside characater control,0.0772,0.067,0.0,0.9329999999999999
B3_S2,B3,S,S2,real life so that people learn,real life so that people learn,"['real', 'life', 'people', 'learn']",real life people learn,0.0,0.0,0.0,1.0
B3_S3,B3,S,S3,a Black characater with a diversity of friends / Calvin from McDonald's,a black characater with a diversity of friends calvin from mcdonald s,"['black', 'characater', 'diversity', 'friend', 'calvin', 'mcdonald', 's']",black characater diversity friend calvin mcdonald s,0.4767,0.22,0.0,0.78
B3_S4,B3,S,S4,"Calvin / friends (Francis, Bobby, Dillon, Blake), parents (Calvin Sr. Marie)",calvin friends francis bobby dillon blake parents calvin sr marie,"['calvin', 'friends', 'francis', 'bobby', 'dillon', 'blake', 'parents', 'calvin', 'sr', 'marie']",calvin friends francis bobby dillon blake parents calvin sr marie,0.4767,0.256,0.0,0.7440000000000001
B4_S1,B4,S,S1,Kingdom invasion  and community must work together to surve,kingdom invasion and community must work together to surve,"['kingdom', 'invasion', 'community', 'work', 'surve']",kingdom invasion community work surve,0.0,0.0,0.0,1.0
B4_S2,B4,S,S2,Everyone interacts with civilians fashys,everyone interacts with civilians fashys,"['interact', 'civilian', 'fashy']",interact civilian fashy,0.0,0.0,0.0,1.0
B4_S3,B4,S,S3,There is no main character. its the civilians fashy,there is no main character its the civilians fashy,"['no', 'main', 'character', 'civilian', 'fashy']",no main character civilian fashy,-0.29600000000000004,0.0,0.21600000000000003,0.784
B5_S1,B5,S,S1,"Interact with secondary characters; given specific scenarios for each of those characters, and each combination would produce a specific outcome",interact with secondary characters given specific scenarios for each of those characters and each combination would produce a specific outcome,"['interact', 'secondary', 'character', 'give', 'specific', 'scenario', 'character', 'combination', 'produce', 'specific', 'outcome']",interact secondary character give specific scenario character combination produce specific outcome,0.0,0.0,0.0,1.0
B5_S2,B5,S,S2,Main character is a superhero (pick your own name and identity); secondary characters should be different people from different walks of life,main character is a superhero pick your own name and identity secondary characters should be different people from different walks of life,"['main', 'character', 'superhero', 'pick', 'identity', 'secondary', 'character', 'different', 'people', 'different', 'walk', 'life']",main character superhero pick identity secondary character different people different walk life,0.0,0.0,0.0,1.0
B5_S3,B5,S,S3,Superhero plot,superhero plot,"['superhero', 'plot']",superhero plot,0.0,0.0,0.0,1.0
B5_S4,B5,S,S4,Gotham-esque,gotham esque,"['gotham', 'esque']",gotham esque,0.0,0.0,0.0,1.0
B6_S1,B6,S,S1,Plot: given a situation up front based on real-world police-community conflict and need to figure out how to resolve together,plot given a situation up front based on real world police community conflict and need to figure out how to resolve together,"['plot', 'give', 'situation', 'base', 'real', 'world', 'police', 'community', 'conflict', 'need', 'figure', 'resolve']",plot give situation base real world police community conflict need figure resolve,0.0772,0.10400000000000001,0.092,0.8029999999999999
B6_S2,B6,S,S2,"Setting: real-world, city, diverse population",setting real world city diverse population,"['set', 'real', 'world', 'city', 'diverse', 'population']",set real world city diverse population,0.0,0.0,0.0,1.0
B6_S3,B6,S,S3,Players should always feel like they're the main character in their own story; there are also secondary impartial characters,players should always feel like they re the main character in their own story there are also secondary impartial characters,"['player', 'feel', 'like', 'main', 'character', 'story', 'secondary', 'impartial', 'character']",player feel like main character story secondary impartial character,0.3612,0.11599999999999999,0.0,0.884
B6_S4,B6,S,S4,"Characters: two main groups - police and community, subroles depending on the scenario",characters two main groups police and community subroles depending on the scenario,"['character', 'main', 'group', 'police', 'community', 'subrole', 'depend', 'scenario']",character main group police community subrole depend scenario,0.0,0.0,0.0,1.0
