unique_id,workshop_id,sn_type,sn_id,sn_content,sn_clean,sn_token,sn_token_str,compound_s,positive_s,negative_s,neutral_s
B5_L4,B5,L,L4,Different scenarios with different decisions available; players will see the consequences of the actions they take,different scenarios with different decisions available players will see the consequences of the actions they take,"['different', 'scenario', 'different', 'decision', 'available', 'player', 'consequence', 'action']",different scenario different decision available player consequence action,0.0,0.0,0.0,1.0
B6_L1,B6,L,L1,No knowledge needed to play; soft skills  empathy and conflict resolution and facts inequities in policing,no knowledge needed to play soft skills empathy and conflict resolution and facts inequities in policing,"['no', 'knowledge', 'need', 'play', 'soft', 'skill', 'empathy', 'conflict', 'resolution', 'fact', 'inequity', 'police']",no knowledge need play soft skill empathy conflict resolution fact inequity police,-0.2732,0.121,0.226,0.653
B6_L2,B6,L,L2,Role shifting and resolution of conflict,role shifting and resolution of conflict,"['role', 'shifting', 'resolution', 'conflict']",role shifting resolution conflict,-0.3182,0.0,0.315,0.685
B6_L3,B6,L,L3,differential understandings between community and police (racial and police status),differential understandings between community and police racial and police status,"['differential', 'understanding', 'community', 'police', 'racial', 'police', 'status']",differential understanding community police racial police status,0.0,0.0,0.0,1.0
B6_L4,B6,L,L4,Who's playing? police officers and community members; patrol officers,who s playing police officers and community members patrol officers,"['s', 'play', 'police', 'officer', 'community', 'member', 'patrol', 'officer']",s play police officer community member patrol officer,0.2023,0.16699999999999998,0.0,0.833
B6_L5,B6,L,L5,Goal: establish empahty for others' experience through moving through simulatied role changes,goal establish empahty for others experience through moving through simulatied role changes,"['goal', 'establish', 'empahty', 'experience', 'move', 'simulatied', 'role', 'change']",goal establish empahty experience move simulatied role change,0.0,0.0,0.0,1.0
